{
  "$schema": "./marismart_function_map.schema.json",
  "schemaVersion": "1.0",
  "object": {
    "id": "GENERIC-1",
    "version": "2.1-draft",
    "status": "draft",
    "defaultLanguage": "ms",
    "languages": [
      "ms",
      "en"
    ],
    "title": {
      "ms": "Peta Fungsi Konseptual",
      "en": "Conceptual function map"
    },
    "subtitle": {
      "ms": "Skematik pembelajaran generik, bukan susun atur peralatan yang disahkan",
      "en": "Generic learning schematic, not a verified equipment layout"
    }
  },
  "ui": {
    "fallbackBadge": {
      "ms": "Paparan 2D",
      "en": "2D fallback"
    },
    "fallbackExplain": {
      "ms": "Peranti ini tidak menyokong AR, jadi paparan 2D digunakan. Kandungan pembelajarannya sama.",
      "en": "This device does not support AR, so the 2D view is shown. The learning content is the same."
    },
    "openInAR": {
      "ms": "Buka dalam AR",
      "en": "Open in AR"
    },
    "languageToggle": {
      "ms": "English",
      "en": "Bahasa Melayu"
    },
    "state": {
      "notExplored": {
        "ms": "Pilih untuk meneroka",
        "en": "Select to explore"
      },
      "explored": {
        "ms": "Diterokai",
        "en": "Explored"
      },
      "checked": {
        "ms": "Disemak",
        "en": "Checked"
      }
    },
    "progress": {
      "ms": "{explored}/{total} titik diterokai · {checked} disemak",
      "en": "{explored}/{total} points explored · {checked} checked"
    },
    "pointHeading": {
      "ms": "TITIK {id}",
      "en": "POINT {id}"
    },
    "resetPractice": {
      "ms": "Set semula latihan",
      "en": "Reset practice"
    },
    "exportRecord": {
      "ms": "Eksport rekod saya (PDF)",
      "en": "Export my record (PDF)"
    },
    "sections": {
      "function": {
        "ms": "Fungsi",
        "en": "Function"
      },
      "purpose": {
        "ms": "Tujuan pembelajaran pemeriksaan",
        "en": "Inspection learning purpose"
      },
      "observe": {
        "ms": "Apa yang diperhatikan",
        "en": "What to observe"
      },
      "evidence": {
        "ms": "Bukti yang direkod",
        "en": "Evidence to record"
      },
      "doNot": {
        "ms": "Jangan lakukan",
        "en": "Do not"
      },
      "commonMistakes": {
        "ms": "Kesilapan biasa",
        "en": "Common mistakes"
      },
      "quickCheck": {
        "ms": "Semak cepat",
        "en": "Quick check"
      },
      "verification": {
        "ms": "Status pengesahan",
        "en": "Verification status"
      },
      "links": {
        "ms": "Pautan",
        "en": "Links"
      },
      "scenarios": {
        "ms": "Senario: apa tindakan anda?",
        "en": "Scenarios: what would you do?"
      },
      "metadata": {
        "ms": "Metadata objek dan pengesahan",
        "en": "Object metadata and validation"
      }
    },
    "feedback": {
      "correct": {
        "ms": "Betul",
        "en": "Correct"
      },
      "incorrect": {
        "ms": "Belum tepat",
        "en": "Not quite"
      },
      "tryAgain": {
        "ms": "Cuba lagi",
        "en": "Try again"
      }
    },
    "verificationStatus": {
      "verified": {
        "ms": "Disahkan",
        "en": "Verified"
      },
      "pending": {
        "ms": "Menunggu semakan pakar",
        "en": "Awaiting expert review"
      },
      "unverified": {
        "ms": "Belum disahkan",
        "en": "Not verified"
      }
    },
    "awaiting": {
      "ms": "Menunggu",
      "en": "Awaiting"
    },
    "selfCheckLocked": {
      "ms": "Terokai kesemua 5 titik untuk membuka",
      "en": "Explore all 5 points to unlock"
    },
    "selfCheckOpen": {
      "ms": "Mula semak kendiri",
      "en": "Start self-check"
    },
    "metaLabels": {
      "id": {
        "ms": "ID dan versi",
        "en": "ID and version"
      },
      "contentOwner": {
        "ms": "Pemilik kandungan",
        "en": "Content owner"
      },
      "smeReviewer": {
        "ms": "Penyemak pakar bidang",
        "en": "Subject-matter reviewer"
      },
      "reviewDate": {
        "ms": "Tarikh semakan",
        "en": "Review date"
      },
      "nextReviewDate": {
        "ms": "Semakan seterusnya",
        "en": "Next review"
      },
      "unverified": {
        "ms": "Perkara belum disahkan",
        "en": "Not verified"
      },
      "sources": {
        "ms": "Rujukan sumber",
        "en": "Source references"
      },
      "stcw": {
        "ms": "Penjajaran STCW",
        "en": "STCW alignment"
      },
      "ai": {
        "ms": "Pernyataan penggunaan AI",
        "en": "AI use statement"
      }
    }
  },
  "evidenceFields": {
    "equipmentTag": {
      "ms": "Tag peralatan",
      "en": "Equipment tag"
    },
    "point": {
      "ms": "Titik",
      "en": "Point"
    },
    "observation": {
      "ms": "Pemerhatian",
      "en": "Observation"
    },
    "guardStatus": {
      "ms": "Status pengadang",
      "en": "Guard status"
    },
    "value": {
      "ms": "Nilai",
      "en": "Value"
    },
    "unit": {
      "ms": "Unit",
      "en": "Unit"
    },
    "time": {
      "ms": "Masa",
      "en": "Time"
    },
    "reference": {
      "ms": "Rujukan",
      "en": "Reference"
    },
    "uncertainty": {
      "ms": "Ketidakpastian",
      "en": "Uncertainty"
    },
    "findings": {
      "ms": "Dapatan",
      "en": "Findings"
    },
    "authorisedPerson": {
      "ms": "Orang diberi kuasa dimaklumkan",
      "en": "Authorised person informed"
    },
    "signature": {
      "ms": "Tandatangan",
      "en": "Signature"
    }
  },
  "progression": {
    "states": [
      "notExplored",
      "explored",
      "checked"
    ],
    "exploredWhen": "point_opened",
    "checkedWhen": "quick_check_correct",
    "selfCheck": {
      "id": "06",
      "title": {
        "ms": "Semak kendiri",
        "en": "Self-check"
      },
      "unlockAfterExplored": 5,
      "questionOrder": [
        "03",
        "01",
        "04",
        "02",
        "05"
      ],
      "source": "points[].quickCheck"
    },
    "persistence": "localStorage key 'marismart.GENERIC-1.progress'; optional, fail silently if unavailable"
  },
  "points": [
    {
      "id": "01",
      "key": "drive",
      "colour": "#1F5FB8",
      "title": {
        "ms": "Pemacu",
        "en": "Drive"
      },
      "function": {
        "ms": "Membekalkan gerakan mekanikal dalam sistem generik ini.",
        "en": "Provides mechanical motion in this generic system."
      },
      "purpose": {
        "ms": "Perhati dan rekod hanya keadaan luaran yang dibenarkan. Keperluan akses selamat dan pengadang mesti disahkan.",
        "en": "Observe and record only the permitted external condition. Safe access and guarding requirements must be verified."
      },
      "observe": [
        {
          "ms": "Pengadang gandingan berada di tempatnya dan tidak rosak.",
          "en": "Coupling guard is in place and undamaged."
        },
        {
          "ms": "Plat nama motor boleh dibaca; rekod seperti yang tertera.",
          "en": "Motor nameplate is legible; record it as marked."
        },
        {
          "ms": "Keadaan luaran kabel dan kotak terminal, tanpa sentuhan.",
          "en": "External condition of the cable and terminal box, without contact."
        },
        {
          "ms": "Bunyi, getaran, bau atau perubahan warna yang luar biasa: huraikan sahaja, jangan ukur tanpa kebenaran.",
          "en": "Unusual noise, vibration, smell or discolouration: describe only; do not measure without authorisation."
        }
      ],
      "evidence": [
        "point",
        "observation",
        "guardStatus",
        "time"
      ],
      "doNot": [
        {
          "ms": "Jangan sentuh atau menghulurkan tangan ke arah bahagian berputar.",
          "en": "Do not touch or reach towards rotating parts."
        },
        {
          "ms": "Jangan buka, alih atau mengintai di sebalik pengadang.",
          "en": "Do not open, remove or look behind the guard."
        },
        {
          "ms": "Jangan sentuh permukaan motor kerana mungkin panas.",
          "en": "Do not touch the motor surface; it may be hot."
        }
      ],
      "commonMistakes": [
        {
          "ms": "Menganggap pengadang ada tanpa memeriksanya.",
          "en": "Assuming the guard is in place without checking."
        },
        {
          "ms": "Menulis \"OK\" tanpa menghuraikan apa yang diperhatikan.",
          "en": "Writing \"OK\" without describing what was observed."
        }
      ],
      "quickCheck": {
        "question": {
          "ms": "Semasa pemeriksaan, anda dapati pengadang gandingan tiada. Apakah tindakan anda?",
          "en": "During the inspection you find the coupling guard missing. What do you do?"
        },
        "options": [
          {
            "text": {
              "ms": "Teruskan pemeriksaan dengan berhati-hati.",
              "en": "Continue the inspection carefully."
            },
            "correct": false,
            "feedback": {
              "ms": "Tidak selamat. Pengadang yang tiada ialah keadaan tidak selamat.",
              "en": "Unsafe. A missing guard is an unsafe condition."
            }
          },
          {
            "text": {
              "ms": "Henti, jauhkan diri dan laporkan kepada penyelia dengan segera.",
              "en": "Stop, keep clear and report to the supervisor immediately."
            },
            "correct": true,
            "feedback": {
              "ms": "Betul. Jangan teruskan sehingga keadaan dinilai oleh orang diberi kuasa.",
              "en": "Correct. Do not continue until an authorised person has assessed the condition."
            }
          },
          {
            "text": {
              "ms": "Pasang semula pengadang sendiri.",
              "en": "Refit the guard yourself."
            },
            "correct": false,
            "feedback": {